{
  "company": "Rockwell Automation",
  "industry": "industrial automation",
  "size_estimate": "large, tens of thousands of employees globally",
  "business_model": "Sells industrial automation and information hardware, software, and services to manufacturers.",
  "evidence_ids": ["EV-001"],
  "evidence": [
    {
      "evidence_id": "EV-001",
      "source": "https://rockwellautomation.com",
      "source_type": "official_company_source",
      "source_date": "2026-06-01",
      "retrieval_date": "2026-07-18",
      "evidence_text": "Rockwell Automation is a global provider of industrial automation and digital transformation solutions, helping manufacturers connect people, processes, and technology to run smarter, safer, and more sustainable operations.",
      "confidence": 0.9,
      "claim_type": "fact",
      "support_type": "direct"
    }
  ]
}
